questionType,contentType,contentBody,intAnswer,prepTime(in_seconds),floatAnswer.max,floatAnswer.min,fitbAnswer,mcscAnswer,subjectiveAnswer,option.1,option.2,option.3,option.4,mcmcAnswer,tagRelationships,difficultyLevel,answerExplanationType,answerExplanation
mcsc,text,What is regularization in the context of linear regression?,,,,,,2,,Removing all features before training,Adding a penalty during training to discourage excessively large coefficients and reduce overfitting,Increasing the training set size by duplicating rows,Using only the intercept term and ignoring all features,,69e246178f1856a8e953d1e2,0,text,Regularization penalizes large weights so the model generalizes better instead of memorizing noise.
mcsc,text,Which statement best distinguishes Ridge from Lasso?,,,,,,2,,"Ridge's penalty is tied to the sum of absolute coefficient values, while Lasso's penalty is tied to the sum of squared coefficient values",Ridge shrinks coefficients but typically does not set them to exactly zero; Lasso can set some coefficients exactly to zero,Ridge removes all features from the dataset before training; Lasso keeps all features,Neither Ridge nor Lasso uses a tuning setting such as alpha,,69e246178f1856a8e953d1e2,0,text,Ridge (L2) shrinks all coefficients; Lasso (L1) can produce exact zeros and thus feature elimination.
mcmc,text,Select all statements that are true about Ridge regression.,,,,,,,,It adds a penalty related to the sum of squared coefficients,It can eliminate a feature by setting its coefficient exactly to zero,Increasing alpha generally increases the strength of shrinkage,It is often appropriate when many features are weakly but genuinely related to the target,"1, 3, 4",69e246178f1856a8e953d1e2,0,text,Ridge does not usually zero coefficients (that is Lasso's behavior). Stronger alpha means a stronger penalty.
mcsc,text,"For regression, MAE and RMSE are both expressed in the same units as the target. Which statement is most accurate?",,,,,,3,,"RMSE treats a 10-unit error as exactly twice as bad as a 5-unit error, same as MAE",MAE is more sensitive to a few very large errors than RMSE,RMSE penalizes large errors more heavily than MAE because errors are squared before averaging,MAE cannot be used when the target is continuous,,69e246178f1856a8e953d1e2,0.5,text,Squaring in MSE (and thus RMSE) makes large mistakes dominate more than in MAE.
mcmc,text,Which statements about R-squared are correct?,,,,,,,,It measures the proportion of variance in the target explained by the model,A value of 0 means the model is equivalent to always predicting the mean of the target (on the evaluation setup used),A negative R-squared is impossible,R-squared alone does not tell you whether absolute prediction errors are acceptable for a business use case,"1, 2, 4",69e246178f1856a8e953d1e2,0.5,text,R-squared can be negative for very poor models. Use MAE/RMSE for scale of errors; R-squared for explained variation relative to a mean baseline.
mcsc,text,"In scikit-learn, what does the alpha hyperparameter control for Ridge and Lasso?",,,,,,3,,The fraction of data used for training versus testing,The random seed used when shuffling or splitting data,How strong the regularization penalty is,Only the step size if you were using plain gradient descent by hand,,69e246178f1856a8e953d1e2,0.5,text,Higher alpha means a stronger penalty (more shrinkage in Ridge; more zeroing in Lasso).
mcmc,text,"A marketing analyst fits ordinary least squares to predict sales from advertising spend on TV, radio, and newspaper. Empirically, newspaper spend is often a weak or irrelevant predictor, yet OLS may still estimate a nonzero coefficient on a finite training sample. Which statements are generally plausible?",,,,,,,,OLS may assign a nonzero weight to newspaper because of sampling noise and spurious correlation in the training data,Ridge typically shrinks the newspaper coefficient relative to OLS,"Lasso may set the newspaper coefficient exactly to zero, effectively excluding that channel from the model",Regularization guarantees higher test-set R-squared than OLS on every random train/test split,"1, 2, 3",69e246178f1856a8e953d1e2,1,text,Regularization helps but does not guarantee better test metrics in every run or split.
mcsc,text,"You fit a regression model and inspect test-set residuals (actual minus predicted), plotted against predictions or a feature. Which situation most strongly suggests that the model may be missing structure (for example wrong functional form or missing predictors)?",,,,,,2,,Residuals look randomly scattered with no clear trend,Residuals show a clear systematic pattern (such as a curve or funnel shape),Training accuracy is higher than test accuracy,The model uses fewer than five features,,69e246178f1856a8e953d1e2,1,text,Random-looking residuals are what we hope for on a good-enough model; a systematic pattern in residuals usually means the model has not captured something important.
